{
  "schemaVersion": 1,
  "deckId": "co-creation-signage-report",
  "defaultLanguage": "en-ja",
  "languages": [
    "en-ja",
    "zh",
    "en",
    "ja",
    "es-MX"
  ],
  "compositeLanguages": {
    "en-ja": {
      "primary": "en",
      "secondary": "ja",
      "policy": "balanced-emphasis"
    }
  },
  "chapters": [
    {
      "id": "background",
      "titleKey": "chapters.background"
    },
    {
      "id": "research-design",
      "titleKey": "chapters.researchDesign"
    },
    {
      "id": "methods",
      "titleKey": "chapters.methods"
    },
    {
      "id": "conclusions",
      "titleKey": "chapters.conclusions"
    }
  ],
  "layouts": [
    "cover",
    "standard",
    "evidence",
    "process",
    "principles",
    "audit",
    "comparison",
    "system",
    "heatmap",
    "data",
    "closing",
    "references"
  ],
  "assets": [
    {
      "id": "cover-qr",
      "path": "src/assets/images/cover-qr.png",
      "access": "public",
      "legacyPath": "ppt/qr-code.png"
    },
    {
      "id": "aa",
      "path": "src/assets/images/aa.jpg",
      "access": "public",
      "legacyPath": "src/assets/images/aa.jpg"
    },
    {
      "id": "bb",
      "path": "src/assets/images/bb.jpg",
      "access": "public",
      "legacyPath": "src/assets/images/bb.jpg"
    },
    {
      "id": "field-experiment",
      "path": "src/assets/images/field-experiment.jpg",
      "access": "public",
      "legacyPath": "ppt/images/02-experiment-scene.jpg"
    },
    {
      "id": "fukuoka-botanical-garden",
      "path": "src/assets/images/fukuoka-botanical-garden.jpg",
      "access": "public",
      "legacyPath": "ppt/images/02-fukuoka-botanical-garden.jpg"
    },
    {
      "id": "sign-example-01",
      "path": "src/assets/images/sign-example-01.jpg",
      "access": "public",
      "legacyPath": "ppt/images/01.jpg"
    },
    {
      "id": "sign-example-02",
      "path": "src/assets/images/sign-example-02.jpg",
      "access": "public",
      "legacyPath": "ppt/images/02.JPG"
    },
    {
      "id": "sign-example-03",
      "path": "src/assets/images/sign-example-03.jpg",
      "access": "public",
      "legacyPath": "ppt/images/03.JPG"
    },
    {
      "id": "field-observation",
      "path": "src/assets/images/field-observation.jpg",
      "access": "public",
      "legacyPath": "ppt/images/01-field-observation.jpg"
    },
    {
      "id": "intervention-sign",
      "path": "src/assets/images/intervention-sign.jpg",
      "access": "public",
      "legacyPath": "ppt/images/07-intervention-sign.jpg"
    },
    {
      "id": "annotation-tool",
      "path": "src/assets/images/annotation-tool.jpg",
      "access": "public",
      "legacyPath": "ppt/images/08-tool-annotator.jpg"
    },
    {
      "id": "annotator-editor",
      "path": "src/assets/images/annotator-editor.jpg",
      "access": "public",
      "legacyPath": "src/assets/images/annotator-editor.jpg"
    },
    {
      "id": "annotator-map",
      "path": "src/assets/images/annotator-map.jpg",
      "access": "public",
      "legacyPath": "src/assets/images/annotator-map.png"
    },
    {
      "id": "annotator-coding",
      "path": "src/assets/images/annotator-coding.jpg",
      "access": "public",
      "legacyPath": "src/assets/images/annotator-coding.png"
    },
    {
      "id": "annotator-dashboard",
      "path": "src/assets/images/annotator-dashboard.jpg",
      "access": "public",
      "legacyPath": "src/assets/images/annotator-dashboard.png"
    },
    {
      "id": "signage-annotator-logo",
      "path": "src/assets/images/signage-annotator-logo.jpg",
      "access": "public",
      "legacyPath": "ppt/images/logo1.png"
    },
    {
      "id": "visual-attention-logo",
      "path": "src/assets/images/visual-attention-logo.jpg",
      "access": "public",
      "legacyPath": "ppt/images/logo2.png"
    },
    {
      "id": "visual-attention-banner",
      "path": "src/assets/images/visual-attention-banner.jpg",
      "access": "public",
      "legacyPath": "src/assets/images/visual-attention-banner.png"
    },
    {
      "id": "signage-field-map",
      "path": "src/assets/images/signage-field-map.jpg",
      "access": "public",
      "legacyPath": "ppt/images/标识图片.png"
    },
    {
      "id": "control-sign",
      "path": "src/assets/images/control-sign.jpg",
      "access": "public",
      "legacyPath": "ppt/images/06-control-sign.jpg"
    },
    {
      "id": "calibration-screen",
      "path": "src/assets/images/calibration-screen.jpg",
      "access": "public",
      "legacyPath": "ppt/images/10-calibration.jpg"
    },
    {
      "id": "eye-flow-cover",
      "path": "src/assets/images/eye-flow-cover.jpg",
      "access": "public",
      "legacyPath": "src/assets/images/eye-flow-cover.png"
    },
    {
      "id": "eye-flow-01a",
      "path": "src/assets/images/eye-flow-01a.jpg",
      "access": "public",
      "legacyPath": "src/assets/images/eye-flow-01a.jpg"
    },
    {
      "id": "eye-flow-01b",
      "path": "src/assets/images/eye-flow-01b.jpg",
      "access": "public",
      "legacyPath": "src/assets/images/eye-flow-01b.jpg"
    },
    {
      "id": "eye-flow-02a",
      "path": "src/assets/images/eye-flow-02a.jpg",
      "access": "public",
      "legacyPath": "src/assets/images/eye-flow-02a.jpg"
    },
    {
      "id": "eye-flow-02b",
      "path": "src/assets/images/eye-flow-02b.jpg",
      "access": "public",
      "legacyPath": "src/assets/images/eye-flow-02b.jpg"
    },
    {
      "id": "eye-flow-03a",
      "path": "src/assets/images/eye-flow-03a.jpg",
      "access": "public",
      "legacyPath": "src/assets/images/eye-flow-03a.jpg"
    },
    {
      "id": "eye-flow-03b",
      "path": "src/assets/images/eye-flow-03b.jpg",
      "access": "public",
      "legacyPath": "src/assets/images/eye-flow-03b.jpg"
    },
    {
      "id": "eye-flow-03c",
      "path": "src/assets/images/eye-flow-03c.jpg",
      "access": "public",
      "legacyPath": "src/assets/images/eye-flow-03c.png"
    },
    {
      "id": "eye-flow-04a",
      "path": "src/assets/images/eye-flow-04a.jpg",
      "access": "public",
      "legacyPath": "src/assets/images/eye-flow-04a.png"
    },
    {
      "id": "eye-flow-04b",
      "path": "src/assets/images/eye-flow-04b.jpg",
      "access": "public",
      "legacyPath": "src/assets/images/eye-flow-04b.png"
    },
    {
      "id": "heatmap-p01-control",
      "path": "src/assets/images/heatmap-p01-control.jpg",
      "access": "restricted-derived",
      "legacyPath": "ab2/academic_heatmap_akama kumiko_a1 修正版1 (1).png"
    },
    {
      "id": "heatmap-p02-control",
      "path": "src/assets/images/heatmap-p02-control.jpg",
      "access": "restricted-derived",
      "legacyPath": "ab2/academic_heatmap_ataqi_a1.png"
    },
    {
      "id": "heatmap-p03-control",
      "path": "src/assets/images/heatmap-p03-control.jpg",
      "access": "restricted-derived",
      "legacyPath": "ab2/academic_heatmap_harada keiko_a1 修正版1.png"
    },
    {
      "id": "heatmap-p04-control",
      "path": "src/assets/images/heatmap-p04-control.jpg",
      "access": "restricted-derived",
      "legacyPath": "ab2/academic_heatmap_kimura_b1 修正版1.png"
    },
    {
      "id": "heatmap-p05-control",
      "path": "src/assets/images/heatmap-p05-control.jpg",
      "access": "restricted-derived",
      "legacyPath": "ab2/academic_heatmap_koga eiichi_a1 修正版1.png"
    },
    {
      "id": "heatmap-p06-control",
      "path": "src/assets/images/heatmap-p06-control.jpg",
      "access": "restricted-derived",
      "legacyPath": "ab2/academic_heatmap_moro izumi_a1 修正版1.png"
    },
    {
      "id": "heatmap-p07-control",
      "path": "src/assets/images/heatmap-p07-control.jpg",
      "access": "restricted-derived",
      "legacyPath": "ab2/academic_heatmap_saku yoshisuke_a1 修正版1.png"
    },
    {
      "id": "heatmap-p08-control",
      "path": "src/assets/images/heatmap-p08-control.jpg",
      "access": "restricted-derived",
      "legacyPath": "ab2/academic_heatmap_umetu ayane_b1 修正版1.png"
    },
    {
      "id": "heatmap-p09-control",
      "path": "src/assets/images/heatmap-p09-control.jpg",
      "access": "restricted-derived",
      "legacyPath": "ab2/academic_heatmap_yamada rena_a1 修正版1.png"
    },
    {
      "id": "heatmap-p10-control",
      "path": "src/assets/images/heatmap-p10-control.jpg",
      "access": "restricted-derived",
      "legacyPath": "src/assets/images/heatmap-p10-control.jpg"
    },
    {
      "id": "heatmap-p11-control",
      "path": "src/assets/images/heatmap-p11-control.jpg",
      "access": "restricted-derived",
      "legacyPath": "src/assets/images/heatmap-p11-control.jpg"
    },
    {
      "id": "heatmap-p12-control",
      "path": "src/assets/images/heatmap-p12-control.jpg",
      "access": "restricted-derived",
      "legacyPath": "src/assets/images/heatmap-p12-control.jpg"
    },
    {
      "id": "heatmap-p13-control",
      "path": "src/assets/images/heatmap-p13-control.jpg",
      "access": "restricted-derived",
      "legacyPath": "src/assets/images/heatmap-p13-control.jpg"
    },
    {
      "id": "heatmap-p01-intervention",
      "path": "src/assets/images/heatmap-p01-intervention.jpg",
      "access": "restricted-derived",
      "legacyPath": "ab2/academic_heatmap_akama kumiko_a2 修正版1.png"
    },
    {
      "id": "heatmap-p02-intervention",
      "path": "src/assets/images/heatmap-p02-intervention.jpg",
      "access": "restricted-derived",
      "legacyPath": "ab2/academic_heatmap_ataqi_a2 修正版1.png"
    },
    {
      "id": "heatmap-p03-intervention",
      "path": "src/assets/images/heatmap-p03-intervention.jpg",
      "access": "restricted-derived",
      "legacyPath": "ab2/academic_heatmap_harada keiko_a2 修正版1.png"
    },
    {
      "id": "heatmap-p04-intervention",
      "path": "src/assets/images/heatmap-p04-intervention.jpg",
      "access": "restricted-derived",
      "legacyPath": "ab2/academic_heatmap_kimura_b2 修正版1.png"
    },
    {